{
  "standardVersion": "3.0.0",
  "toolVersion": "design-lab 0.22.0",
  "generatedAt": "2026-10-06T15:23:29",
  "source": {
    "strategy": "css-custom-properties",
    "root": "/fixture/Sites/PNCB/worktrees/pncb-2026-merge",
    "stylesheets": [
      "docroot/themes/custom/pncb/css/2026/base.css",
      "docroot/themes/custom/pncb/css/2026/legacy.css",
      "docroot/themes/custom/pncb/css/2026/tokens.css"
    ],
    "librariesFiles": [
      "docroot/modules/custom/pncb_addthis/pncb_addthis.libraries.yml",
      "docroot/modules/custom/pncb_workspace_preview_banner/pncb_workspace_preview_banner.libraries.yml",
      "docroot/themes/custom/pncb/pncb.libraries.yml"
    ],
    "ignoredNotLoaded": [
      "docroot/sites/default/files/css/css_CBdX0MA0F09ZSCZ-obLe06P9LNsbSc-o5H8FvQmU5pE.css",
      "docroot/sites/default/files/css/css_EV_LkyfqDPQ-v-axvfG9pC-S8U7RP9XRIhy7PEdlPxk.css",
      "docroot/sites/default/files/css/css_K2UdPaWKydy34MM__MFnpy4No42RVuFwOTuXFT7YSBY.css"
    ]
  },
  "modes": [
    "Value",
    "@media (width < 48rem)"
  ],
  "modeRationale": "custom properties are redeclared under 1 media query, so those are real modes",
  "typeScaling": {
    "observable": true,
    "noneScale": false,
    "reason": "3 font-size/line-height token(s) are redeclared under a media query",
    "roleLevelCaveat": "This measures the TOKENS. A component rule may still switch which token it uses at a breakpoint (`font-size: var(--text-2xl)` inside a media query), which is role-level scaling this source cannot see. Grep the consuming rules before concluding the type ramp is fixed."
  },
  "totals": {
    "tokens": 181,
    "base": 181,
    "component": 0,
    "shadowed": 10,
    "byFamily": {
      "color": 88,
      "font-family": 4,
      "font-size": 17,
      "font-weight": 8,
      "letter-spacing": 4,
      "line-height": 9,
      "motion": 2,
      "number": 6,
      "radius": 8,
      "spacing": 35
    }
  },
  "tokens": [
    {
      "name": "action-on-primary",
      "codeName": "--action-on-primary",
      "raw": "#ffffff",
      "value": "#ffffff",
      "family": "color",
      "isAlias": false,
      "selector": ":root",
      "media": null,
      "layer": "base",
      "provenance": {
        "kind": "config",
        "ref": "docroot/themes/custom/pncb/css/2026/tokens.css"
      },
      "valuesByMode": {
        "Value": "#ffffff"
      }
    },
    {
      "name": "action-primary",
      "codeName": "--action-primary",
      "raw": "#2c2a6f",
      "value": "#2c2a6f",
      "family": "color",
      "isAlias": false,
      "selector": ":root",
      "media": null,
      "layer": "base",
      "provenance": {
        "kind": "config",
        "ref": "docroot/themes/custom/pncb/css/2026/tokens.css"
      },
      "valuesByMode": {
        "Value": "#2c2a6f"
      }
    },
    {
      "name": "action-primary-hover",
      "codeName": "--action-primary-hover",
      "raw": "#1d1c4b",
      "value": "#1d1c4b",
      "family": "color",
      "isAlias": false,
      "selector": ":root",
      "media": null,
      "layer": "base",
      "provenance": {
        "kind": "config",
        "ref": "docroot/themes/custom/pncb/css/2026/tokens.css"
      },
      "valuesByMode": {
        "Value": "#1d1c4b"
      }
    }
  ],
  "shadowed": [
    {
      "name": "radius-pill",
      "value": "999px",
      "layer": "base",
      "provenance": {
        "kind": "config",
        "ref": "docroot/themes/custom/pncb/css/2026/tokens.css"
      }
    },
    {
      "name": "space-xxl-plus",
      "value": "40px",
      "layer": "component",
      "provenance": {
        "kind": "config",
        "ref": "docroot/themes/custom/pncb/css/2026/tokens.css"
      }
    },
    {
      "name": "space-xxxl",
      "value": "56px",
      "layer": "component",
      "provenance": {
        "kind": "config",
        "ref": "docroot/themes/custom/pncb/css/2026/tokens.css"
      }
    }
  ],
  "problems": []
}
